rid,name,area,address,phone no.,opening hours
1014,三協成糕餅博物館,新北,新北市淡水區中正路81號,02-26212177,09:00~20:00(可能依天候狀況調整營業時間)
1015,北新有機休閒農場,新北,新北市淡水區忠寮里7鄰演戲埔腳3之2號,02-26231428,周二至周日08:00-12:00
1016,興福寮花卉綜合農場,新北,新北市淡水區樹興里5鄰興福寮3號,02-86261401,9:00 - 16:00
1017,幸福農莊(原大屯溪自然農法教育農莊),新北,新北市淡水區屯山里番社前11號,02-28762882,"開放參觀,但需預約"
1018,紅樹林生態教育館,新北,新北市淡水區中正東路二段68號2樓,02-28082995,週三~日09:00~17:00
1019,橫山梯田,新北,新北市三芝區橫山里,02-86355143,全年開放
1020,富福頂山寺(貝殼廟),新北,新北市三芝區圓山里二坪頂69號,02-26367002,02-26367131
1021,智成忠義宮,新北,新北市三芝區埔坪里智成街18號,02-26362218,02-26366450
1022,智成堂,新北,新北市三芝區錫板里5鄰海尾17號,02-26362557,06:00~19:00
1023,番婆林觀光花園,新北,新北市三芝區錫板里17鄰番婆林44號,02-26362716,09-21070169
1024,興旺養蜂教育農園,新北,新北市三芝區興華村北新莊車埕72之7號,02-26371276,06:30~20:00
1025,二號倉庫．文創,新北,新北市三芝區中山路一段4號(三芝農會旁),02-26361052,"週一 ,二,四,五：11:30-17:00,週三公休,週六 - 週日:11:00-21:00"
1026,水口民主公王廟,新北,新北市三芝區新庄里57之1號,02-26364096,06:00~21:00
1027,八仙宮,新北,新北市三芝區新庄里蕃社后31之1號,02-26360743,06:00~21:00
1028,木屐寮農莊,新北,新北市三芝區圓山村4鄰38號,02-26360061,10:00~17:00
1029,八連溪紅葉谷,新北,新北市三芝區紅葉谷,02-26362111,全年開放
1030,三芝共榮社區,新北,新北市三芝區八賢里,02-26362111,全年開放
1031,源興居,新北,新北市三芝區埔坪里埔頭坑 164-2 號,02-26362111,不開放入內參觀
1032,谷垚陶坊生活藝術館,新北,新北市三芝區後厝里蘭陽街40號(芝蘭別墅),02-86351580,09-28803050
1033,綠竹園,新北,新北市三芝區茂長村51號,02-86351639,二~五 11:00~17:00
1034,烏來妙心寺,新北,新北市烏來區烏來里2鄰烏來街71號,02-26616397,08:00–17:00
1035,信賢瀑布,新北,新北市烏來區信賢村(內洞森林遊樂區),02-26617358,全年開放
1036,五重溪瀑布,新北,新北市烏來區北107鄉道近福山,02-26616442,全年開放
1037,泰雅巴萊部落村 (烏來生態農場),新北,新北市烏來區烏來里14鄰西羅岸路132號 (約西羅岸路 5.5 公里處),02-26617551,"電話預約
週六日 10：00~17：00"
1038,桶後溪,新北,新北市烏來區桶後溪,02-23515441,欲前需向烏玉檢查哨辦理入山申請
1039,信賢吊橋,新北,新北市烏來區,02-26616442,全年開放
1040,直潭山登山步道,新北,新北市新店區直潭山,02-29112281,全年開放
1041,青潭尖(大崎頭山),新北,新北市新店區青潭尖,02-29112281,全年開放
1042,岐山巖,新北,新北市新店區屈尺路125號,02-26668220,全年開放
1043,長福巖,新北,新北市新店區廣興路34之1號,02-26711031,06:00 ~ 22:00
1044,磺窟城聚落,新北,新北市新店區新潭路二段,02-29112281,全年開放
1045,戰俘營紀念碑,新北,新北市新店區新潭路三段,02-29112281,全年開放
1046,新店渡船頭,新北,新北市新店區渡船頭,02-29112281,全年開放
1047,梅花湖(屈尺景觀公園),新北,新北市新店區梅花湖,02-29112281,全年開放
1048,小粗坑遺址,新北,新北市瑞芳區猴硐小粗坑遺址,02-24972250,全年開放
1049,東獅頭山,新北,新北市新店區東獅頭山,02-29112281,全年開放
1050,廣興河濱公園,新北,新北市新店區平廣溪廣興路98號旁,02-29112281,全年開放
1051,龜山營地,新北,新店區新烏路三段195巷5號,02-26665824,需在三個月前先向校方提出申請
1052,水資源生態教育館,新北,新北市新店區新烏路三段43號,02-26667811,星期二至星期五 09:30-12:00 / 14:00~16:00
1053,忠順廟,新北,新北市汐止區義民里11鄰公園路10號,02-26416900,02-86423610
1054,待老坑山,新北,新北市新店區待老坑山,02-29112281,全年開放
1055,瓊仔湖公園步道,新北,新北市泰山區黎明路,02-29099551,全年開放
1056, 泰山娃娃產業文化館,新北,新北市泰山區楓江路26巷26號4樓,02-85311406,週二至週日9：30~17：00
1057,林口婦幼公園,新北,新北市林口區麗園一街,02-26033111,全年開放
1058,三峽染工坊暨三峽藍染中心,新北,新北市三峽區中山路20巷3號(歷史文物館旁),02-86713108,"10:00～17:00 (每週一公休)，藍染體驗：每週六、日10:00~16:00
平日僅接受20人以上團體預約)，每週一公休"
1059,德興有機生態教育農場,新北,新北市三峽區添福里添福12-14號,02-26725824,08:00~17:00(請事先預約)
1060,千戶傳奇生態農場,新北,新北市三峽區有木里有木154-3號,02-26720748,平日11:30-19:00、假日11:00-19:00、週一公休
1061,蜜蜂世界,新北,新北市三峽區有木里194-1號,02-26720362,假日上午7點開店到下午7點(平日來電預約)
1062,簡單生活藍染工作室,新北,新北市三峽區插角里90號,02-26711017,請來電預約
1063,鴛鴦谷遊樂園,新北,新北市三峽區有木里130-1號,02-26720384,08:00 - 19:00
1064,臺華窯臺灣風華館,新北,新北市鶯歌區中正一路426號,02-26780000,周一至周六: 08:00 ~ 17:30 周日: 09:00 ~ 18:00
1065,西湖陶坊,新北,新北市鶯歌區文化路339號,02-26707103,09:00~21:00
1066,磺嘴山,新北,新北市萬里區磺嘴山,02-24922064,欲進度入，請先向向陽明山國家公園管理處申請入山
1067,峰頭尖,新北,新北市平溪區峰頭尖,02-24951510,全年開放
1068,石筍尖步道,新北,新北市平溪區石筍尖,02-24951510,全年開放
1069,山尖路步道,新北,新北市瑞芳區山尖路174號,02-24972250,全年開放
1070,穿屋巷,新北,新北市瑞芳區九份輕便路,02-24972250,全年開放
1071,燦光寮登山步道,新北,新北市瑞芳區金瓜石燦光寮山,02-24972250,全年開放
1072,漁光里步道,新北,新北市坪林區漁光里,02-26657251,全年開放
1073,天上山系步道,新北,新北市土城區天上山,02-22732000,全年開放
1074,五城山,新北,新北市土城區五城山,02-22732000,全年開放
1075,石門內尖山,新北,新北市土城區石門內尖山(土城區公所),02-22732000,全年開放
1076,鳶山登山步道,新北,新北市三峽區鳶山,02-26711017,全年開放
1077,五寮尖登山步道,新北,新北市三峽區五寮尖山,02-26711017,全年開放
1078,龍山岩石景浮雕,新北,新北市三峽區五寮尖,02-26711017,全年開放
1079,黑松三姊妹,新北,新北市三峽區五寮尖,02-26711017,全年開放
1080,湊合十八洞天,新北,新北市三峽區湊合橋,02-26711017,全年開放
1081,湊合賞鳥區,新北,新北市三峽區插角,02-26711017,全年開放
1082,白雞山登山步道,新北,新北市三峽區白雞山,02-26711017,全年開放
1083,雞罩山,新北,新北市三峽區雞罩山,02-26711017,全年開放
1084,鹿窟尖山(湊角山),新北,新北市三峽區湊角山,02-26711017,全年開放
1085,三峽紫微天后宮,新北,新北市三峽區竹崙里紫微南路50號,02-26726400,09:00–17:00
1086,雲森瀑布,新北,新北市三峽區雲森瀑布,02-26711017 ,全年開放
1087,大同山登山步道,新北,新北市樹林區大同山,02-26812106,全年開放
1088,八里左岸自行車道,新北,新北市八里區左岸,02-89699596,全天開放
1089,金色水岸自行車道,新北,新北市淡水區渡船頭,02-89699596,全年開放
1090,瑞芳風景特定區,新北,新北市瑞芳區汽車路89號,02-24972250,全年開放
1091,烏來風景區,新北,新北市烏來區烏來街45號之1(烏來遊客中心),02-26616355,全年開放
1092,黃金瀑布,新北,新北市瑞芳區金水公路,02-24972250,全年開放
1093,深坑集順廟,新北,新北市深坑區深坑街135號,02-26622534,06:00~21:00
1094,新北市政府景觀瞭望台,新北,新北市板橋區中山路一段161號32樓,02-29603456,08：00~23：00
1095,三重神農大帝祭,新北,新北市三重區五谷王北街77號,02-29952345,三重神農大帝祭：農曆4月25日
1096,牧師樓,新北,新北市淡水區真理街32號,02-26281212,10:00 - 19:00(週一休館)
1097,芝柏藝術村,新北,新北市三芝區芝柏路,02-26362111,週一~五休息 週六~日10:00 - 17:00
1098,滬尾砲臺公園,新北,新北市淡水區沙崙路216巷,02-26221020,全年開放
1099,八連溪休閒步道,新北,新北市三芝區淡金公路18.5公里處(2號省道),02-26362111,全年開放
1100,無極真元天壇(天元宮),新北,新北市淡水區北新路3段36號,02-26212759,02-26219159
1101,八里(渡船頭)老街,新北,新北市八里區渡船頭街,02-26102621,全年開放(依店家營業時間為主)
1102,烏來老街,新北,新北市烏來區烏來街,02-26616442,全年開放(依店家營業時間為主)
1103,鶯歌老街,新北,新北市鶯歌區文化路、尖山埔路,02-26780202,全年開放(依店家營業時間為主)
1104,菁桐鐵道故事館,新北,新北市平溪區菁桐街54號,02-24951258,09:00~19:00
1105,觀音巖旁八仙洞,新北,新北市平溪區石底里觀音巖側,02-24951292,08:00~17:00
1106,酋長文化歌舞劇場,新北,新北市烏來區烏來里瀑布路34號,02-26616551,"""上午10：00-下午15：00
場次(10：20 , 11：20 , 14：00 , 15：00)"""
1107,九份金礦博物館,新北,新北市瑞芳區九份頌德里石碑巷66號,02-24966379,平日：10:00-18:00 假日：09:00-18:00
1108,新店文史館,新北,新北市新店區北新路一段92號,02-29115534,週一及週二休館，週三至週日為8:30~17:00
1109,富士坪古道,新北,新北市萬里區富士坪古道,02-24922064,全年開放
1110,鹿堀(窟)坪古道,新北,新北市萬里區鹿堀(窟)坪,02-24922064,欲前往民眾請先向國家公園管理處申請
1111,磺港漁港,新北,新北市金山區磺溪下游出海口,02-89526055,全年開放
1112,慈母峰步道,新北,新北市平溪區石底里靜安路二段,02-24951510,全年開放
1113,插天山自然保留區,新北,新北市三峽區插天山,02-26711017,入山請先申請
1114,坪林臺灣油杉自然保留區,新北,新北市坪林區北宜公路(往宜蘭方向39公里、41公里處),02-26657251,需事先申請
1115,樹林南寮福德宮冷泉,新北,新北市樹林區坡內里3鄰保安街二段45巷53號,02-26753711,02-26753712
1116,溪洲運動河濱公園,新北,新北市土城區環河道路,02-22732000,全年開放
1117,重新橋觀光市集,新北,新北市三重區疏洪十六路(重新橋下),02-29748767,週二至週五06:00-14:00，星期例假日06:00-15:00(每週一公休)
1118,十分車站,新北,新北市平溪區十分街51號,02-24958307,全年開放
1119,望古車站,新北,新北市平溪區望古車站,02-24972033,全年開放
1120,大華車站,新北,新北市平溪區226六分12號旁,02-24972033,全年開放
1121,三貂嶺車站,新北,新北市瑞芳區碩仁里魚寮路1號,02-21910096,06:00-24:00
1122,嶺腳車站,新北,新北市平溪區嶺腳車站,02-24972033,全年開放
1123,遠光打鐵店,新北,新北市石碇區石碇東街12號,02-26631080,8:00~18:00
1124,金瓜寮茶香生態村,新北,新北市坪林區金瓜寮,02-26657251,全年開放
1125,大棟山,新北,新北市樹林區大棟山登山步道,02-26812106,全年開放
1126,布袋戲主題館,新北,新北市淡水區重建街48號,02-26221020,09：30∼12：00、13：30∼17：00，週一公休
1127,屈尺水岸,新北,新北市新店區屈尺路,02-29112281,全年開放
1128,五指山風景區,新北,新北市汐止區五指山,02-26411111,全年開放
1129,前清英國領事館,新北,新北市淡水區中正路28巷1號,02-26231001,"週一至週五 9:30—17:00 週六至週日 9:30—18:00，夏季延長開放時間（4月至10月，僅戶外區）：週一至週五 17:00—20:00 週六至週日 18:00—20:00

休館時間：
每月第一個星期一（逢國定假日照常開放，翌日休館）、農曆除夕、年初一、政府公告之天然災害停止上班日，其他必要之休館日將另行公告。"""
1130,猴硐煤礦博物園區,新北,新北市瑞芳區猴硐柴寮路42號(猴硐火車站正對面),02-24974143,8:00-18:00，除夕僅開放8:00-12:00(猴硐旅遊資訊站)
1131,運煤橋,新北,新北市瑞芳區猴硐柴寮路42號(願景館)靠基隆河側,02-24972250,全年開放
1132,瑞三礦業整煤廠,新北,新北市瑞芳區猴硐柴寮路42號(願景館)旁,02-24974143,不開放入內參觀
1133,猴硐一百階,新北,新北市瑞芳區猴硐路(近介壽橋),02-24972250,全年開放
1134,瑞三本礦口,新北,新北市瑞芳區猴硐柴寮路,02-24974143,全年開放
1135,復興礦坑口,新北,新北市瑞芳區猴硐路,02-24974143,全年開放
1136,猴硐坑,新北,新北市瑞芳區猴硐猴硐路158號旁,02-24975757,全年開放
1137,手信坊創意和菓子文化館,新北,新北市土城區國際路55號,02-82620506,全年開放08:30-19:00
1138,許新旺陶瓷紀念博物館,新北,新北市鶯歌區尖山埔路81號,02-26789571,週二 ~ 週日 10：00 - 17：00
1139,三峽農特產文化館,新北,新北市三峽區正義街18號,02-26723868,導覽時間：週一至周五09：00∼16：00、週六09：00∼ 12：00
1140,淡水登峰魚丸博物館一館,新北,新北市淡水區中正路117號,02-26293312,11:00–21:00
1141,坪林旅遊服務中心,新北,新北市坪林區北宜路8段67號,02-26658020,09:00-17:00  除夕為09:00~12:00
1142,烏來吊橋,新北,新北市烏來區烏來立體停車場(烏來老街旁),02-26616442,全年開放
1143,烏來遊客中心,新北,新北市烏來區烏來里烏來街45-1號,02-26616355,9:00-18:00
1144,獅頭山,新北,新北市新店區碧潭東岸,02-29112281,全日開放
1145,江璞亭公祖祠堂,新北,新北市板橋區南雅西路一段174巷20號,02-29686911,為私人宅院，未對外開放
1146,員山子分洪道,新北,新北市瑞芳區瑞侯公路,02-89669870,全年開放
1147,蘆洲功學社音樂廳KHS Hall,新北,新北市蘆洲區中山二路162號2樓,02-22825151,平時不對外開放，僅在有表演時才開放
1148,錦和運動公園,新北,新北市中和區錦和路、中正路口,02-22482688,全年開放
1149,石碇淡蘭藝文館,新北,新北市石碇區石碇村石碇東街87號,02-26634381,開放時間09:00-17:00，週一及國定假日休館
1150,直潭壩,新北,新北市新店區康雅崙路21號,02-29112281,全年開放
1151,一滴水紀念館,新北,新北市淡水區中正路一段6巷30號(和平公園內),02-26263350,星期二至星期日(國定假日)9：00-17：00，【休館時間】 每星期一休館，農曆除夕至年初四休館、選舉日休館、政府公告之天然災害停止上班日、本館另行公告之休館日（含年度維修、清館日、重大會議使用等），本休館日公告除特殊情形外，於一個月前公告。
1152,光淙金工藝術館,新北,新北市林口區粉寮路一段104號,02-86014430,週二至週日9：00-17：00(最後入館時間下午四點)
1153,宏洲磁磚觀光工廠,新北,新北市鶯歌區中正三路230巷16號,02-86782786,週二至週六09:30~17:00，每週日、週一休館(國定假日照常開放，隔日休館)；農曆春節請參考網站公告為主。
1154,琉傳天下琉星花園,新北,新北市淡水區忠寮里口湖子1-7號,02-26256972,預約參觀，週五 ~ 週二 10：00 - 17：00(假日至18:00)，週三週四休館
1155,空軍三重一村,新北,新北市三重區正義南路86巷,02-89535332,10:00 - 18:00
1156,三重綜合運動場,新北,新北市三重區中正北路2號,02-29867046,全年開放
1157,中山藝術公園,新北,新北市三重區重新路三段,02-29862345,全年開放
1158,林泉成古厝,新北,新北市新莊區新莊路405號,02-29603456,室外開放，室內請來電預約
1159,北大特區藝術大道,新北,新北市三峽區學勤路,02-26711017,全年開放
1160,水晶博物館,新北,新北市中和區中正路1180號1-2樓,02-82215482,11:00 - 22:00 
1161,新山夢湖,新北,新北市汐止區夢湖路,02-26411111,全年開放
1162,猴硐貓村,新北,新北市瑞芳區光復里,02-24971266,全年開放
1163,山宛然客家布袋戲團,新北,新北市板橋區縣民大道三段83號3樓(山宛然劇團辨公室),02-29686911,演出時間依官網公告為主
1164,澳底漁港,新北,新北市貢寮區真理里,02-24991210,全年開放
1165,遠望坑親水公園,新北,新北市貢寮區,02-24991210,全年開放
1166,粗坑仔,新北,新北市萬里區雙興村太和路,02-24922064,全年開放
1167,龍門公園(龍門露營度假基地),新北,新北市貢寮區福隆村興隆街100號(台2線100公里處),02-24991791,08:00-17:00  (露營時間為12:00隔日12:00)
1168,中角灣,新北,新北市金山區台2線39公里處,02-24985965,全年開放
1169,水尾景觀公園,新北,新北市金山區中角海灘,02-24985965,全年開放
1170,烏來觀光台車,新北,新北市烏來區覽勝大橋與溫泉路口交會處,02-26617826,平日 08：00∼17：00，(7~8月) 09：00∼18：00
1171,金水公路,新北,新北市瑞芳區金水公路,02-24972250,全年開放
1172,大漢溪自行車道,新北,新北市樹林區環河道路,02-26812106,全年開放
1173,新店溪自行車道,新北,新北市新店區,02-29112281,全年開放
1174,風芝門自行車道,新北,新北市三芝區淺水灣,02-26362111,全年開放
1175,金山萬里自行車道,新北,新北市金山區,02-29603456,全年開放
1176,坪林觀魚步道,新北,新北市坪林區水柳腳,02-26657251,全年開放
1177,舊草嶺隧道,新北,新北市貢寮區福隆里,02-24991210 ,6/1-9/30開放時間08:30-17:30(假日延長至18:00)(17:00開始清場) 10/1至翌年5/31開放時間08:30-17:00(16:30開始清場)
1178,石碇北宜公路,新北,新北市石碇區石崁路與雙青公路交接口處,02-26631080,全年開放
1179,雙溪老街,新北,新北市雙溪區長安街15號,02-24931111,全年開放(依店家營業時間為主)
1180,新北市政府行政大樓,新北,新北市板橋區中山路1段161號,02-29603456,週一至週五08:30~17:30
1181,博愛藝術街,新北,新北市永和區博愛街,02-29282828,全年開放(以各店家營業時間為主)
1182,義學坑自然生態公園,新北,新北市泰山區明志路二段254巷底,02-29099551,全年開放
1183,四廣潭,新北,新北市平溪區南山坪四廣潭,02-24958409,全年開放
1184,烏來瀑布 空中纜車,新北,新北市烏來區瀑布路1-1號,02-26616510,"平日09:30 – 17:00
假日09:30 – 17:30"
1185,桶後,新北,新北市烏來區桶後林道,02-26616442,全年開放
1186,礦工宿舍,新北,新北市瑞芳區光復里柴寮路,02-24974143,全年開放(室內不開放)
1187,開天宮,新北,新北市新店區新店路65號,02-29138934,05:00~18:00
1188,小赤壁,新北,新北市新店區碧潭風景區內,02-29112281,全年開放
1189,平溪郵局老郵筒,新北,新北市平溪區平溪街42號,02-24951510,全年開放
1190,祈堂老街(金瓜石老街),新北,新北市瑞芳區金瓜石祈堂路,02-24972250,全年開放(依店家營業時間為主)
1191,窯廠遺址,新北,新北市鶯歌區文化路145巷內,02-26780202,全年開放
1192,牡丹車站,新北,新北市雙溪區牡丹里牡丹路159號,02-24932980,06:00~24:00
1193,雙溪車站,新北,新北市雙溪區新基里朝陽街1號,02-24932980,06:00~24:00
1194,十三層親水園區,新北,新北市雙溪區,02-24931111,全年開放
1195,根德水車園區,新北,新北市三芝區淡金路一段(2號省道18.3公里處),02-26362111,全年開放
1196,櫻木花道,新北,新北市三芝區大湖路(鄉道北7線),02-26362111,全年開放
1197,蘆洲李宅古蹟-李友邦將軍紀念館,新北,新北市蘆洲區中正路243巷19號,02-22838896,9:00-17:00(週一公休)
1198,九芎根親水公園,新北,新北市坪林區粗窟里九芎根5號之1,02-26657251,全年開放
1199,古煙囪,新北,新北市鶯歌區中正一路與文化路口,02-26780202,全年開放
1200,汐止老街,新北,新北市汐止區中正路,02-26411111,全年開放(依店家營業時間為主)
1201,米市巷,新北,新北市新莊區新莊路387巷,02-29603456,全年開放
1202,八里五福宮,新北,新北市八里區米倉村渡船頭二號,02-26101895,早上7:00至晚上8:00
1203,水湳洞遊客中心(山城食堂),新北,新北市瑞芳區濂洞里洞頂路155-8號,02-24961588,全年開放 9:00-18:00
1204,山城美館展演藝廊,新北,新北市瑞芳區濂洞里洞頂路155-8號,02-24972250,9:00-17:30；【公休日】週一
1205,基山街,新北,新北市瑞芳區九份基山街,02-24063270,全年開放
1206,國際終戰和平紀念園區,新北,新北市瑞芳區金瓜石祈堂路40號旁,02-24063270,全年開放
1207,板橋車站,新北,新北市板橋區縣民大道2段7號,02-89691036,06：00~24：00
1208,板橋萬坪公園,新北,新北市板橋區文化路、新府路口,02-29686911,全年開放
1209,淡水泰迪熊博物館,新北,新北市淡水區學府路28號5樓,02-26253958,10:30~21:30
1210,龍洞四季灣,新北,新北市貢寮區和美里和美街48號,02-24901000,09:00-17:30
1211,卯澳漁村,新北,新北市貢寮區福連里(濱海公路旁近三貂角),02-24991210,全年開放
1212,意象陶坊,新北,新北市瑞芳區輕便路278號,02-24062388,09:00-17:00(會不定時公休，DIY需事前預約)
1213,水湳洞十三層遺址,新北,新北市瑞芳區(約九份溪出海口兩岸),02-24972250,全年開放
1214,蔡家洋樓,新北,新北市平溪區嶺腳里嶺腳街(嶺腳車站附近),02-24951510,室內不開放
1215,菁桐煤礦紀念公園,新北,新北市平溪區菁桐街50號,02-24951510,全年開放
1216,烏來林業生活館,新北,新北市烏來區瀑布路1-2號,02-26616780,09：00~17：00；【公休日】週二、除夕、初一
1217,莊貢生古厝,新北,新北市雙溪區梅竹蹊67號,02-24932631,園區開放時間08:00〜17:30(全年無休)用餐電洽
1218,扁屋,新北,新北市雙溪區上林里路段,02-24931111,全年開放
1219,平溪石底橋,新北,新北市平溪區(平溪街與106縣道路交接處),02-24951510,全年開放
1220,猴硐神社,新北,新北市瑞芳區侯硐路61號,02-24972250,全年開放
1221,廣安宮,新北,新北市金山區金包里街104號,02-24982510 ,05：30-21：00
1222,長福橋,新北,新北市三峽區長福橋,02-26711017,全年開放
1223,平溪防空洞(日治防空洞),新北,新北市平溪區公園街,02-24951510,全年開放
1224,關渡大橋,新北,新北市八里區龍米路一段170號,02-26187888,全年開放
1225,蘆堤寵物公園,新北,新北市五股區環提大道,02-29603456,全年開放
1226,荷花廣場,新北,新北市三重區疏洪一路與中山路交叉口,02-27057716,全年開放
1227,幸福水漾公園,新北,新北市三重區疏洪16路,02-29862345,全年開放
1228,龜吼漁港,新北,新北市萬里區漁澳路85-3號(龜吼漁港安檢所),02-89526055,10：00～19：00（各攤位實際營業時間略有不同，請事先詢問）
1229,福隆車站,新北,新北市貢寮區福隆里福隆街2號,02-24991800,全年開放
1230,大屯溪古道休閒農場,新北,三芝區北新庄三板二橋(大屯溪古道旁),02-26362111,採團體預約制，須去電洽詢
1231,玉美人孕婦裝觀光工廠,新北,新北市板橋區四川路2段16巷10號5樓,02-89669762,"週二至週六 10：00~17：30 
週一與國定例假日休館"
1232,八里渡船頭,新北,新北市八里區渡船頭街,02-26102071,全天開放
1233,柑腳養生村,新北,新北市雙溪區長源里8鄰32號,02-24934981,十人以上團體開放預約
1234,鶯歌車站,新北,新北市鶯歌區文化路68號,02-26792004,06:00~24:00
1235,土城媽祖田運動公園,新北,新北市土城區,02-29603456,全年開放
1236,東興宮,新北,新北市貢寮區福隆里東興街3號,02-24991123,06:00-18:00
1237,四腳亭車站,新北,新北市瑞芳區吉慶里中央路65號,02-24579346,6:00-24:00
1238,臺灣電力公司北部展示館,新北,新北市萬里區野柳里八斗60號,02-24985112,"星期二至星期日08:20~16:20
星期一休館 /農曆除夕、年初一及初二休館"
1239,淡水渡船頭,新北,新北市淡水區環河道路,02-86301845,7:00~20:00  (10-15分/班，依天候與人潮機動調整班次)
1240,長仁社區廢煙管,新北,新北市瑞芳區金水公路往長仁社區入口200公尺,02-24972250,不開放入內參觀
1241,彭園 (台陽公司附設醫院),新北,新北市瑞芳區豎崎路41號,02-24063270,不開放入內參觀
1242,金瓜石地質公園 (本山礦體),新北,新北市瑞芳區102縣道18公里處,02-24972250,全年開放
1243,九份遊客中心,新北,新北市瑞芳區汽車路89號,02-24063270,09:00-18:00
1244,十分風景特定區(十分遊客中心),新北,新北市平溪區南山坪136號,02-24958409,每日08:00~18:00  農曆除夕為8:00-12:00
1245,德興居(歐里人文咖啡),新北,新北市深坑區深坑街48號,02-26644525,9:00-17:00
1246,猴硐車站,新北,新北市瑞芳區猴硐柴寮路70號,02-24977747,04:00-24:00(配合列車停靠時間調整)
1247,福隆遊客服務中心,新北,新北市貢寮區福隆里興隆街38號,02-24991210,09:00~17:00  旅游旺季(6~8月)：08:30~17:30
1248,金城公園,新北,新北市土城區金城路一段127巷旁,02-22732010,全年開放
1249,大羅蘭溪,新北,新北市烏來區福山部落,02-26616442,全年開放
1250,平溪藍染工作坊,新北,新北市平溪區白石里白石腳 24之1號,02-24951551,採預約制
1251,燭臺雙嶼,新北,新北市金山區獅頭山公園海濱,02-24988980,全年開放
1252,黃正南薄胎瓷碗工作室,新北,新北市鶯歌區中正一路建德二巷22號,02-26791355,工作室為私人住宅，參觀前請先電話預約
