rid,name,area,address,phone no.,opening hours
2410,【台疆祖廟】大觀音亭 ,臺南,臺南市北區成功路86號,06-2286720,全年無休
2411,綠色魔法學校,臺南,臺南市北區小東路25號 (力行校區),06-2757575#50091,10:00~17:00( 週一休館)
2412,臺灣府城大南門,臺南,臺南市中西區聖前里南門路34巷邊,06-2953407,無
2413,鄭成功紀念公園,臺南,臺南市安南區城西街二段,06-2991111,全年開放
2414,鶯料理(鷲嶺食肆),臺南,臺南市中西區忠義路2段84巷18號,06-2210595,"▴週二至週五 13:00-21:00
▴週六、日 10:00-21:00
▴週一公休"
2415,布袋嘴寮代天府(百年魚木),臺南,臺南市安南區布袋路60號,06-2467042,全天開放
2416,臺南市西拉雅文化會館,臺南,臺南市新化區永新路11號3樓,06-5982307,"週一~週五 9:00~12:00、14:00~17:00 
週六、週日休館"
2417,臺南市南瀛客家文化會館,臺南,臺南市新營區民權路96-27號,06-6337627,週二~週日09:00~12:00、13:30~17:00、週一休館
2418,臺南市客家文化會館,臺南,臺南市南區夏林路4號,06-2220324,週二至週日 9:00～12:00；13:30～17:00 、週一及國定假日休館
2419,北門遊客中心,臺南,臺南市北門區北門里舊埕200號,06-7861017,週一~週日09:00~17:30、除夕日休館
2420,龍山漁港,臺南,臺南市七股區龍山里龍山宮前,06-7875105,全年開放
2421,葫蘆埤自然公園,臺南,臺南市官田區中山路二段207號,06-6350190,全年無休
2422,國立中興大學新化林場,臺南,臺南市新化區口埤76號,06-5900022,週一~週日06:30~17:00
2423,八老爺牧場,臺南,臺南市柳營區八翁里93-139號,06-6226238,週二~週日10:00~18:00、週一公休
2424,南紡世貿展覽中心,臺南,臺南市仁德區義林路77號,06-2701815,09:00~18:00 視展覽開放
2425,北極殿(中西區),臺南,臺南市中西區民權路二段89號,06-2268875,08:00~20:00，全年開放
2426,原日軍台南衛戍病院,臺南,臺南市北區小東路25號(成功大學力行校區),06-2757575,請洽成功大學
2427,六重溪溫泉,臺南,臺南市白河區關嶺里28-3號,06-6822293,依溫泉旅館開放時間及票價
2428,立康中草藥產業文化館,臺南,臺南市永康區王行里環工路29號(永康工業區),06-2335356,參觀需預約報名 8:00~17:30 週六&日休館
2429,港香蘭綠色健康知識館,臺南,臺南市新市區南科一路1號,06-5052505,週一~週五09:00~17:00
2430,黑橋牌香腸博物館,臺南,臺南市南區中華西路１段103號(安平工業區),06-2616990,週二至週日 09:30~17:30 (週一休館)
2431,網仔寮沙洲,臺南,臺南市七股區鹽埕里68號,06-2842600,全天開放
2432,頂頭額沙洲,臺南,臺南市七股區鹽埕里68號,06-2842600,全天開放
2433,曾文溪口濕地,臺南,臺南市七股區鹽埕里,06-2842600,全天開放
2434,鹽水溪口濕地,臺南,臺南市安南區府安路七段, 06-2842600,無
2435,七股鹽田濕地,臺南,臺南市七股區新山子寮,06-2842600,週一~週日00:00~24:00
2436,南灣碼頭遊憩區,臺南,臺南市七股區十份村十份30-1號, 06-2842600,全年開放
2437,國聖燈塔,臺南,臺南市七股區鹽埕里52號, 06-2842600,全天開放
2438,臺南鹽田永鎮宮,臺南,臺南市安南區鹽田6街26號,06-3840185,無
2439,菁寮老街,臺南,臺南市後壁區墨林里,06-6622725,全天開放
2440,臺灣Holocaust和平紀念館(車路墘教會),臺南,臺南市仁德區文賢路一段598號,06-2662758,預約參觀
2441,北門東隆宮,臺南,臺南市北門區三光里三寮灣127-3號,06-7850135,全年開放
2442,麻豆文化館,臺南,臺南市麻豆區巷口里興國路11號,06-5711466,週二~週日08:00~17:00
2443,大地化石礦石博物館,臺南,臺南市永康區中山北路499巷24弄38號,06-2328026,週二~週日09:00~11:00、14:00~16:00
2444,墨林農村文物展示館,臺南,臺南市後壁區墨林里菁寮217號,06-6621794,"平日電話預約(洪小姐:0917-517435)，每週六日10:00–12:00, 13:30–17:00
(詳細開放時間，請洽官方網站)"
2445,台江六孔管理站(含遊客中心),臺南,臺南市七股區三股里海埔18號,06-7880220,"09:00～16:30 
每週一（遇連續假日順延至假期結束次日休假）及除夕當日休館"
2446,拔馬平埔文物館,臺南,臺南市左鎮區左鎮里128號,06-5731076,採預約參觀
2447,重道崇文坊,臺南,臺南市北區公園路356號(燕潭北畔),06-2213597,無
2448,麻豆林家四房厝,臺南,臺南市麻豆區和平路20號,06-2991111,現為私宅
2449,麻豆護濟宮,臺南,臺南市麻豆區光復路106號,06-5720993,全年無休
2450,安平天后宮(開台天后宮),臺南,臺南市安平區國勝路33號,06-2238695,06:30~21:30，全年開放
2451,鹽埕天后宮,臺南,臺南市南區鹽埕路291巷15號,06-2644245,無
2452,隆田隆本復興宮,臺南,臺南市官田區隆本里中華路二段15巷16號,06-5792022,全年無休
2453,頭社太上龍頭忠義廟,臺南,臺南市大內區頭社里31號,06-5763936,全年無休
2454,西拉雅部落-吉貝耍,臺南,臺南市東山區東河里吉貝耍,06-6233817,全天開放
2455,西拉雅部落-頭社,臺南,臺南市大內區頭社里頭社,06-5763936,全天開放
2456,北門嶼教會,臺南,臺南市北門區永隆里北門31號,06-7862138,無
2457,鹽水天主聖神堂,臺南,臺南市鹽水區西門路19號,06-6521174,"疫情期間不開放參觀
團體若需參觀，請事先電話預約
建議撥打電話時間如下
周四：10:00-15:00
周六：18:00-20:00
周日：9:30-11:00"
2458,東山牛肉崎警察官吏派出所,臺南,臺南市東山區水雲里12號,06-2213569,無
2459,原台南農校日式宿舍群,臺南,臺南市永康區中山南路948號,06-2212597,無
2460,御真影奉安殿(原新化尋常小學校),臺南,臺南市新化區民生路旁(新化演藝廳旁),06-5902269,洽學校
2461,原台南州廳-台灣文學館,臺南,臺南市中西區中正路1號,06-2217201,"▴週二至週日 09:00~18:00
▴休館日：週一（逢國定假日照常休館）、農曆除夕及大年初一、政府公告之天然災害停止上班日、選舉日及本館另行公告之休館日。
▴景點資訊僅供參考，詳細參觀資訊請洽官方網站

館內各設施開放時間：
兒童文學書房：09:00-18:00 (12:00-13:00暫停開放)
圖書室： 09:00-17:00。(目前整修中暫停開放)
藝文商店： 10:00-18:00。
文學咖啡坊： 08:00-18:00。(目前整修中暫停開放)"
2462,竹門綠色隧道,臺南,臺南市白河區南90鄉道上，竹門國小門前道路,06-6855102,全年開放
2463,黑面琵鷺賞鳥亭,臺南,臺南市七股區鹽埕里52號, 06-2842600,無
2464,東山服務區,臺南,臺南市東山區枋子林74-6號,06-6230147,24小時開放
2465,要月吊橋,臺南,臺南市左鎮區草山里南171鄉道2.5公里處(草山月世界風景區),06-5732629,全天開放
2466,凌波吊橋,臺南,臺南市官田區隆田里中山路二段207號,06-5791118,全年開放
2467,大內西拉雅吊橋,臺南,臺南市大內區84號省道頭社交流道旁(西拉雅親子公園),06-5761001,全年開放
2468,永興吊橋,臺南,臺南市楠西區照興里興南3號巷內(楠西區),06-5751615#26,全天開放
2469,玉豐芒果樹綠色隧道,臺南,臺南市白河區竹門派出所為起點至玉豐里南90鄉道,06-6855102,全天開放
2470,佳里木棉綠色隧道,臺南,臺南市佳里區南27區道,06-7222127,全天開放
2471,七股黑板樹廊道,臺南,臺南市七股區南34區道,06-7872611,全天開放
2472,旺萊公園(大潭埤),臺南,臺南市關廟區松腳里緊鄰千佛山菩堤寺,06-5950002,全年開放
2473,芙蓉埤生態園區,臺南,臺南市後壁區長安里,06-6872284,無
2474,崑山湖(鯽魚潭),臺南,臺南市永康區崑大路195號(崑山科技大學校內),06-2727175,全天開放
2475,老牛的家,臺南,臺南市柳營區神農里新厝102號,06-6326301,週一~週日08:00~17:00
2476,洲仔尾保寧宮,臺南,臺南市永康區鹽洲里洲尾街78號,06-2536681,無
2477,六甲鎮南宮,臺南,臺南市六甲區工研路2號,06-6982464,週一~週日05:30~21:00
2478,夕遊出張所,臺南,臺南市安平區古堡街196號,06-3911088,"每週一、二、四、五、日  10:00-18:00
週六  10:00-19:00
週三公休"
2479,四草綠色隧道,臺南,臺南市安南區顯草街一段(四草大眾廟旁),06-2841610,"▴夏令時段（清明假期後至白露）：早上8：30至下午5：00 
▴冬令時段（白露後至清明假期）：早上8：00至下午4：30"
2480,太平境馬雅各紀念教會,臺南,臺南市中西區公園路6號,06-2282184,週一~週五08:30~12:00、14:00~17:00，週六09:00~12:00，需預約。
2481,開基永華宮,臺南,臺南市中西區府前路一段196巷20號,06-2242319 ,06:00~20:00 全年開放
2482,泮宮石坊,臺南,臺南市中西區府中街西側街口處,06-2267151,無
2483,後壁無米樂社區(無米里社區由菁寮里、墨林里、後廍里所組成),臺南,臺南市後壁區菁寮,06-6622231,全天開放
2484,東山175咖啡大道,臺南,臺南市東山區市道175線,無,無
2485,小南海風景區,臺南,臺南市白河區 廣安里5 鄰37-1 號,06-6876947,全年開放
2486,崁頂福安宮,臺南,臺南市白河區關嶺里南寮111號,06-6822547,無
2487,東山碧軒寺,臺南,臺南市東山區東山里218號,06-6801009,週一~週日07:00-20:00
2488,玉井虎頭山,臺南,臺南市玉井區竹圍,06-5741141,全天開放
2489,漚汪文衡殿,臺南,臺南市將軍區忠興里196號,06-7945639,週一~週日00:00~24:00(求還金時間08:00~17:00)
2490,永康探索教育公園,臺南,臺南市永康區永康里永華路、永平街、永大五路、永興路街廓,06-2010308,全年開放
2491,新港社地方文化館,臺南,臺南市新市區豐華里道爺路3號(南科園區內),06-5897603,"周二~周六 9:00~17:00
周日、周一休館"
2492,蘇厝真護宮,臺南,臺南市安定區蘇厝里293-2號,06-5922335,全年無休
2493,官田水雉生態教育園區,臺南,臺南市官田區南64與南65交會處附近,06-5793911,週二~週日09:00~17:00
2494,八田與一紀念園區,臺南,臺南市官田區嘉南66號,06-6982103,"▴週四至週二 9:00~17:30 (平日12:00-13:30休息)
▴每週三休園"
2495,台南藝術大學,臺南,臺南市官田區大崎里66號,06-6930100,全年開放
2496,海安路藝術街,臺南,臺南市中西區海安路,06-2267151,全天候開放
2497,西羅殿,臺南,臺南市中西區和平街90號,06-2285354,週一~週日07:00~21:00
2498,成大榕園,臺南,臺南市東區大學路1號光復校區,06-2757575,電洽
2499,巴克禮公園,臺南,臺南市東區中華東路三段357巷 (台南市立文化中心正門口對面),06-2389673,全天開放
2500,神農街,臺南,臺南市中西區神農街,06-2267151,全天開放
2501,十二佃神榕,臺南,臺南市安南區公學路4段54巷43弄,06-2873320,全年開放
2502,民治市政中心,臺南,臺南市新營區民治路36號,06-6322231,無
2503,歐威電影館,臺南,臺南市新化區中正路488號(楊逵文學紀念館C棟展館),06-5908865,週二~週日09:00~12:00、14:00~17:00、週一休館
2504,二王廟,臺南,臺南市永康區永二街395號,06-2333215,全年無休
2505,大灣廣護宮,臺南,臺南市永康區大灣路286號,06-2714964,週一~週日06:00~21:30
2506,龍崎文衡殿,臺南,臺南市龍崎區中坑里中坑3-2號,06-5940050,全天開放
2507,歸仁文化中心,臺南,臺南市歸仁區信義南路78號,06-3306505,"(整建中，暫不開放，相關課程及活動地點變更情形請洽官網)

中心服務時間: 週一至週五 08:00~17:30；美術館開館時間: 週二至週日 09:00~17:00"
2508,樹谷園區,臺南,臺南市新市區中心東路12號,06-5889955,09:00~17:00(週一及除夕休館)
2509,臺南市政府消防局防災教育館,臺南,臺南市安平區永華路二段898號,06-2975119,週二~週五08:30-12:00 13:30-17:00 參觀前請先預約
2510,王雞屎洋宅,臺南,臺南市安平區國勝路35巷2號,06-2281382,私宅僅開放外觀
2511,安平觀音亭,臺南,臺南市安平區觀音街33號,06-2230523,全年無休
2512,後壁土溝農村美術館,臺南,臺南市後壁區土溝里56之1號,06-6874505,無
2513,樹谷生活科學館,臺南,臺南市新市區中心東路12號,06-5894800,9:00~17:00 週一及除夕休館
2514,新營印度紫檀綠色隧道,臺南,臺南市新營區南70區道,06-6322015,全天開放
2515,HMTM和明紡織文化館,臺南,臺南市七股區大埕里大埕189號,06-7871611,"▴週三-週日：9:00 ~18:00 (週一、週二休館)
▴節慶開放時間另行於臉書公佈"
2516,臺灣金屬創意館,臺南,臺南市永康區永科環路598號,06-2030728,"週一至週五 09:00~12:00、13:00~14:30

※本館採預約制參觀※
▴一般散客須於「三日前」預約；團體客則須於「七日前」完成預約。
▴週六、日僅受理40人以上團體預約參觀。"
2517,康那香不織布創意王國,臺南,臺南市將軍區三吉里三吉66-1號,06-7941573,"週二～週日9:00~17:30
（最後進場時間17:00）
(詳見粉專)"
2518,瓜瓜園地瓜生態故事館,臺南,臺南市新化區中正路65之1號,06-5902966,"▴週一至週日 9:00~17:00 (公休日另公布於粉絲專頁)
▴園區內採自由參觀，如需導覽服務請來電洽詢"
2519,卡多利亞良食故事館,臺南,臺南市後壁區後壁里42-27號,06-6873480,週二~週日10:00~17:00、週一休館
2520,新百祿燕窩觀光工廠,臺南,臺南市南區新和路38號(安平工業區),06-2650924,"▴週二至週五 9:00~12:00、13:00~17:00
▴週六、週日 9:00~17:00
▴週一休館"
2521,天一中藥生活化園區,臺南,臺南市官田區工業路31號(官田工業區),06-6985800,"▴週一至週三：8:00~17:00
▴週五至週日：8:00~17:00
▴週四休館，遇國定假日正常開放"
2522,虹泰水凝膠世界,臺南,臺南市仁德區中正路三段523巷116號,06-2724880,"星期一為休館日。
營業時間為周二至週日。
門市開放時間：09：00 ~ 12：00 和 13：30 ~ 17：00。
平日參訪請於 三天前 預約。"
2523,跨虹吊橋,臺南,臺南市官田區嘉南里68-2號(烏山頭水庫),06-6982103,週一~週日06:00-18:00
2524,虎月吊橋,臺南,臺南市新化區中興路42巷36號,06-5901325,週一~週日06:00-22:00
2525,大武壠吊橋,臺南,臺南市大內區二溪里唭子瓦60 號(走馬瀨農場),06-5760121#3,一年365 天24 小時全天候開放 ( 遊憩設施營業時間平日09:00~17:00、假日08:00~17:00)
2526,望龍吊橋,臺南,臺南市龍崎區崎頂里龍崎國小旁(龍崎區虎形山公園),06-5941326,全年開放
2527,鳳凰吊橋,臺南,臺南市南區體育路87號(竹溪寺),06-2154957,4:00-17:00，全年開放
2528,永成戲院,臺南,臺南市鹽水區水正里過港21號,06-6321047,"▴週三~週五13:30-17:30
▴週六~週日09:30-17:30
▴每週一、二全天休館／民俗三大節日當日休館"
2529,山上天后宮,臺南,臺南市山上區山上里121號,06-5781077,無
2530,竹炭故事館,臺南,臺南市龍崎區崎頂里新市子7鄰223號,06-5940463,全年無休  平日： 8:00~16:30(午休1小時) 假日： 夏令09:00~18:00(午休1小時)  冬令08:00~17:00(午休1小時)
2531,善化糖廠,臺南,臺南市善化區溪美里310號,06-5810218,8:00~21:00
2532,安平天主教文物館,臺南,臺南市安平區安平路850巷2號,06-2232760,採預約制
2533,後壁車站,臺南,臺南市後壁區後壁里77號,06-6872055,全年開放
2534,蘭科植物園,臺南,臺南市山上區玉峰里牛稠埔11-2號,06-5781358,週二-週日 10:00~17:00(週一公休)
2535,西社西㡣殿,臺南,臺南市安平區國勝路35巷12號,06-2292333,週一 - 週日7:00~22:00
2536,永康三崁店糖廠神社遺蹟,臺南,臺南市永康區仁愛街與三民街交界,無,全年開放
2537,新化朝天宮,臺南,臺南市新化區太平里中正路534號,06-5989807,無
2538,鹿耳門歷史文化區域地方文化館,臺南,臺南市安南區媽祖宮一街136號,06-2841386,週一~週日9:00~17:00
2539,國立成功大學博物館,臺南,臺南市東區大學路1號(成功校區),06-2757575#63020,無
2540,仁德十三甲武德宮,臺南,臺南市仁德區文賢路一段81巷90號,06-3660852,無
2541,東門美術館,臺南,臺南市中西區府前路一段203號1樓,06-2131897,週二至週日 13:00~18:00
2542,鹿耳門鎮門宮,臺南,臺南市安南區媽祖宮一街345巷420號,06-2841162,無
2543,新化武德殿,臺南,臺南市新化區東榮里和平街53號, 06-5902192,"▴ 週二至週日：9:00-12:00、13:30-17:00
▴ 週一及國定假日休館"
2544,慈蓮寺,臺南,臺南市左鎮區岡林里10號,06-5730047,無
2545,臨濮堂施氏大宗祠,臺南,臺南市中西區海安路二段97巷32號,06-7942585,無
2546,茅港尾天后宮,臺南,臺南市下營區茅港里163號,06-6894824,全年無休
2547,陳桂記大宗祠,臺南,臺南市學甲區中洲里15之10號,06-7833553,無
2548,樹谷農場,臺南,臺南市新市區中心東路12號,06-5894800,"▴週二至週日 10:00~17:00
▴平日只接受20人以上戶外教學預約團體參觀
▴週一公休"
2549,歸仁美學館,臺南,臺南市歸仁區區中山路一段568號,06-2301518,"週二~週五   12：30~20：30
週六~週日   09：30~17：30
每週一及國定假日休館"
2550,東山農會咖啡文化館,臺南,臺南市東山區東中里中興路1號,06-6802816, 週六-週日10:00~18:00
2551,鹿耳門天后宮,臺南,臺南市安南區媽祖宮一街136號,06-2841386,5:00~21:30 全年開放
2552,月津港親水公園,臺南,臺南市鹽水區橋南街4號,06-6521038,全日開放
2553,二行清王宮,臺南,臺南市仁德區行大街2號,06-2665445,全年無休
2554,羅來受教會,臺南,臺南市左鎮區左鎮里128號,06-5731076,事先預約 (星期日上午主日禮拜時間不開放)
2555,左鎮北極殿,臺南,臺南市左鎮區中正里171-3號,06-5731333,全年無休
2556,新天王殿,臺南,臺南市玉井區沙田里2鄰15號,06-5745107,全年無休
2557,八份姑媽宮,臺南,臺南市西港區港東里八份1號之2,06-7951877,全年開放
2558,子龍廟永昌宮,臺南,臺南市佳里區子龍里(子良廟)40號,06-7262348,全年無休
2559,後甲關帝殿,臺南,臺南市東區富強里中華東路二段96巷1弄1號,06-2356659,4:30~22:00全年無休 (政府公告之颱風假除外)
2560,德高厝上帝廟,臺南,臺南市東區德高里城東街28號,06-2684088,全年無休
2561,彌陀寺,臺南,臺南市東區東門里東門路一段133號,06-2375292,8:30~11:30；14:30~17:30 (周一公休)
2562,龍山寺,臺南,臺南市東區龍山里東門路二段134巷27號,06-2378657,5:50~17:30，全年無休
2563,龍湖寺,臺南,臺南市南化區東和里95號,06-5771648,全年開放
2564,大圓滿廟,臺南,臺南市南化區南化里27號,06-5771686,全年無休
2565,鹽埕北極殿,臺南,臺南市南區鹽埕路159巷1號,06-2653819,夏季(3~10月) 09:00~18:00；冬季（11～2月) 08:30~17:30全年無休 (政府公告之颱風假除外)
2566,竹溪寺,臺南,臺南市南區體育路87號,06-2153468,全年開放
2567,代天院,臺南,臺南市柳營區中山西路一段362號,06-6220314,全年開放
2568,天壇護安宮,臺南,臺南市新化區東榮里護安街42號,06-5905563,全年無休
2569,永安宮,臺南,臺南市新市區仁愛街331號,06-5995091,全年無休
2570,大社東勢北極殿,臺南,臺南市新市區大社里288號,06-5996295,全年無休
2571,同濟宮,臺南,臺南市新營區王公里民族路51號,06-6326605,05:30~21:00(全年無休)
2572,濟安宮,臺南,臺南市新營區忠義街28號,06-6328255,05:00~21:00(全年無休)
2573,真武殿,臺南,臺南市新營區南興里延平路112號,06-6326397,06:00~22:00(全年無休)
2574,學甲大灣清濟宮,臺南,臺南市學甲區大灣里19號,06-7833824,全年無休
2575,保西代天府,臺南,臺南市歸仁區大廟里大廟五街31號,06-2713775,全天
2576,敦源聖廟,臺南,臺南市歸仁區忠孝北路歸仁教會旁,06-2304538,07:00~17:00(全年無休)
2577,護庇宮,臺南,臺南市鹽水區水正里中正路140號,06-6522088,全年開放
2578,大豐南天宮(蔡觀音廟),臺南,臺南市鹽水區大豐里大豐88號,06-6551670,全年開放
2579,下營風鈴木廊道,臺南,臺南市下營區市道174線,06-6892104,全天開放
2580,下營小葉欖仁綠色隧道,臺南,臺南市下營區中山路一段476巷,06-6892104,全天開放
2581,白河後壁印度紫檀廊道,臺南,臺南市白河區172甲道,06-6855102,全天開放
2582,白河將軍埤南洋櫻廊道,臺南,臺南市白河區南89區道，近將軍埤畔,06-6855102,全天開放
2583,後壁上茄苳樟樹廊道,臺南,臺南市後壁區南87鄉道,06-6872284,全天開放
2584,大內石仔瀨天后宮,臺南,臺南市大內區石湖里291號,06-5762655,06:00~21:00(全年無休)
2585,開隆宮,臺南,臺南市中西區中山路79巷56號,06-2212137,全年開放
2586,小南天福德祠,臺南,臺南市中西區忠義路二段158巷27號,06-2211386,全年開放
2587,臨水夫人廟,臺南,臺南市中西區建業街16號,06-2136268,06:00~20:30全年無休(政府公告之颱風假除外)
2588,太子廟明直宮,臺南,臺南市仁德區太子里太子路354號,06-2732645,夏季(3-10)月 06:00-21:30 冬季(11-2)月 06:00-21:00(全年無休)
2589,岳王廟,臺南,臺南市仁德區太子路64號,06-2714884,夏季(3-10)月 06:00-21:30 冬季(11-2)月 06:00-21:00(全年無休)
2590,大甲萬龍宮,臺南,臺南市仁德區大甲里行大一街297之1號,06-2661137,全年無休
2591,正王府,臺南,臺南市七股區十份里53-2號,06-7871145,全年無休
2592,大灣凌霄寶殿武龍宮,臺南,臺南市永康區永大路二段103巷8號,06-2728329,全年無休
2593,林子內教會,臺南,臺南市白河區汴頭里林子內25-1號,06-6857495,教堂24小時開放給尋道者禱告
2594,仙祖廟(紫雲殿),臺南,臺南市白河區關嶺里5鄰關子嶺99-3號,06-6822315,07:00-17:00
2595,安定保安宮,臺南,臺南市安定區安定里131號,06-5923743,全年無休
2596,蘇厝長興宮,臺南,臺南市安定區蘇厝里456號,06-5922450,全年開放
2597,洋仔保生大帝廟,臺南,臺南市新化區豐榮里洋子127號,06-5987996,全年無休
2598,楠西玄天上帝廟,臺南,臺南市楠西區楠西里民族路102號,06-5751036,全年無休
2599,『腳の眼鏡』足部科學體驗中心(紅崴科技股份有限公司),臺南,臺南市安南區工業一路23號,06-2380713,"▴週一至週五：09:00~12:00、13:30~17:00
▴例假日休館"
2600,東和蜂文化觀光工廠,臺南,臺南市東山區東勢1-18號,06-6800773,9:30~17:30 週三公休
2601,台鉅美妝觀光工廠,臺南,臺南市仁德區中正路三段589號,06-2052013,09:00-17:00，每月固定最後一週的星期二休館
2602,洪通故居彩繪村,臺南,臺南市北門區鯤江里1003之1號,06-7861000,無
2603,新安宮藝文中心,臺南,臺南市北門區蚵寮1003之1號,06-7863745,無
2604,噍吧哖事件紀念園區,臺南,臺南市玉井區樹糖街22號,06-5741025,週一、週三至週日09:00~17:00，週二館休，如遇特殊節日依據館內公告為主。
2605,臺南市長官邸「帕莎蒂娜」,臺南,臺南市中西區南門路239號,06-2136039,週一~週日11:30~22:00
2606,華美光學eye玩視界,臺南,臺南市安定區中沙里中工二路30號,06-5937597,"週一~週五 : 上午09:00~下午18:00

週六~週日 : 上午10:00~下午18:00

節慶假日另行公告"
2607,關子嶺大凍山步道&雞籠山,臺南,臺南市白河區紫雲殿仙祖廟,05-2787006,全年開放
2608,陳永華墓(陳永華總制夫婦古墓),臺南,臺南市柳營區果毅後,無,全年開放
2609,左鎮月世界生態學園(岡林國小),臺南,臺南市左鎮區岡林里31號,06-5730107,全天開放
2610,奇美食品幸福工廠,臺南,臺南市仁德區機場路1008號,06-2698588,週二至週日 09:00~17:00 (週一休館，遇連假則順延)
2611,B.B.ART,臺南,臺南市中西區民權路二段48號,06-2233538,週二至週日11:30~19:00 (週一公休)
2612,小北觀光夜市,臺南,臺南市北區西門路四段101號,無,全年開放
2613,美雅家具觀光工廠,臺南,臺南市白河區甘宅101-1號,06-6817456,"▴週三至週日 09:00 - 17：00 
▴週一、週二休館、國定假日連休、春節期間另行公告"
2614,彼緹娃藝術蛋糕觀光工廠,臺南,臺南市佳里區民安里同安寮1-1號,06-7236328,"．參觀時間：上午9:00~下午5:00(每週一公休)(逢連續假期不公休，以公告為主)
．導覽時間：受理預約導覽時間：週二至週日 10：30 ~ 15：30"
2615,國王家族羽絨服飾觀光工廠,臺南,臺南市佳里區民安里同安寮2-8號,06-7213380,週一至週日 09:00 - 17:30
2616,安平定情碼頭-德陽艦園區,臺南,臺南市安平區安億路115號,06-2932925,"9:00-19:00
(11月-翌年3月延長營業時間至18:00)"
2617,漁光島,臺南,臺南市安平區漁光路118號,無,無
2618,台南運河遊船,臺南,臺南市安平區漁人碼頭(安億橋邊安億路旁),903232168,無
2619,木架山大草原,臺南,臺南市新化區山脚里五甲勢,無,無
2620,熱蘭遮城博物館,臺南,臺南市安平區國勝路82號,06-2267348,8:30-17:30
2621,台南市美術館2館,臺南,臺南市中西區忠義路二段1號,06-2218881,"▴每週二~週五&週日10:00~18:00
▴每週六10:00~21:00
▴每週一休館
▴國定例假日照常開館，除夕、初一、初二休館"
2622,台江文化中心,臺南,臺南市安南區安吉路一段205號,06-2558136,"台江劇場：配合演出活動開放。
台江圖書館：每週三至週日09:00-17:00開放（週一與週二休館，每月最後一週五為清潔日該日閉館，逢民俗節慶、國定假日是否休館請洽詢台江文化中心）
終身學習中心：配合臺南社區大學台江分校課程時間開放。"
2623,蘇家古厝,臺南,臺南市新化區中正路341巷31號,無,無
