rid,name,area,address,phone no.,opening hours
1650,大溪慈湖步道,桃園,桃園市大溪區復興路一段1097號,03-3884437,全年無休
1651,捷美休閒農場,桃園,桃園市觀音區新華路2段41號,03-2824225,請事先致電業者預約參觀。
1652,108賴家休閒農場,桃園,桃園市蘆竹區坑子里山林路三段152號,03-3242528,請事先致電業者預約參觀
1653,巧克力共和國,桃園,桃園市八德區介壽路二段490巷旁巧克力街底,365-6555,無
1654,東和音樂體驗館,桃園,桃園市大溪區信義路226號,388-2215*210,無
1655,江記豆腐乳文化館,桃園,桃園市中壢區月眉路2段248巷85號,498-6018,無
1656,祥儀機器人夢工廠,桃園,桃園市桃園區桃鶯路461號,362-3452,無
1657,雅聞魅力博覽館,桃園,桃園市楊梅區中山北路一段21巷1號,488-3800,無
1658,郭元益糕餅博物館,桃園,桃園市楊梅區幼獅工業區青年路9巷1號,496-2201,無
1659,白木屋品牌探索館,桃園,桃園市楊梅區高獅路813巷22弄6號,496-5757,無
1660,南僑桃園觀光體驗工廠,桃園,桃園市桃園區龜山工業區興邦路35號,263-0264,無
1661,桃園酒廠,桃園,桃園市龜山區文化一路55號,328-9001*380,無
1662,卡司蒂菈樂園,桃園,桃園市蘆竹區大竹北路90之66號,255-1999,無
1663,中天健康生活館,桃園,桃園市龍潭區高楊北路81號,471-0888*205,無
1664,義美生產．生態．生活廠區,桃園,桃園市蘆竹區南工路一段11號,311-7525,無
1665,老K舒眠文化館,桃園,桃園市新屋區頭洲村梅高路三段97號,490-5093*115,無
1666,太平洋自行車博物館,桃園,桃園市新屋區永福路786號,486-1231*312,無
1667,麗嬰房采衣館,桃園,桃園市蘆竹區海湖村海山中街8號,354-4417,無
1668,金蘭醬油博物館,桃園,桃園市大溪區介壽路236號,380-1226*290,無
1669,光泉牛奶園地,桃園,桃園市大園區南港村92號,386-5185*111,無
1670,黑松飲料博物館,桃園,桃園市中壢區中壢工業區中園路178號,452-3101*219,無
1671,金車咖啡文教館,桃園,桃園市中壢區榮民南路412號,465-1121*252,無
1672,GFun機能紡織生活館,桃園,桃園市觀音區工業區工業六路3號,0800-038-838,無
1673,台塑企業文物館,桃園,桃園市龜山區文化一路259號,211-8800*3391,無
1674,大溪老茶廠,桃園,桃園市大溪區復興路二段732巷80號,382-5089,無
1675,可口可樂世界,桃園,桃園市桃園區龜山工業區興邦路46號,364-8800,無
1676,養樂多工廠,桃園,桃園市中壢區自強一路4號,452-9994#609,無
1677,源友咖啡文化館,桃園,桃園市平鎮區工業五路8號,4697387#1032,無
1678,福源茶廠,桃園,桃園市龍潭區竹龍路590巷56號,4792533,無
1679,中台資源科技觀光工廠,桃園,桃園市觀音區環科路326號,4730068,無
1680,歐萊德綠建築總部,桃園,桃園市龍潭區中豐路高平段18號,4116789#6316  ,無
1681,蓮荷園休閒農場,桃園,桃園市觀音區金華路690號,03-4776972,無
1682,林家古厝休閒農場,桃園,桃園市觀音區大湖路二段239巷55號,03-4980753,無
1683,捷美休閒農場,桃園,桃園市觀音區大堀里6鄰198-1號,03-2824552,無
1684,江陵日觀休閒農場,桃園,楊梅市西高山頂15-2號,03-4750606,無
1685,好時節休閒農場,桃園,桃園市大溪區康莊路三段225號,03-3889689,無
1686,晨捷休閒農場,桃園,桃園市龍潭區民治16街87巷49弄71號,0921-092-117,無
1687,高雙休閒農場,桃園,桃園市平鎮區復旦路四段116巷51號,0958-532-359,無
1688,小木屋休閒農場,桃園,桃園市蘆竹區坑子里貓尾崎12鄰1號（靠近南勢國小）,03-3245452,無
1689,九斗休閒農場,桃園,桃園市新屋區九斗里4鄰5號,03-3396268,無
1690,戀戀空港灣休閒農場,桃園,桃園市蘆竹區坑口里泉州路11巷215弄183號,"03-3524796
0931-647-696",無
1691,泉園休閒農場,桃園,桃園市蘆竹區坑口里泉州路11巷215弄183號,"03-3524796
0988-530-337",無
1692,108賴家休閒農場,桃園,桃園市蘆竹區坑子里山林路三段152號,03-3242528,無
1693,富田香草休閒農場,桃園,桃園市中壢區青埔區過嶺路二段192巷38弄16號,"03-3872540
 0958-532-359",無
1694,千郁休閒農場,桃園,蘆竹區坑子里八德二路280巷11號,"03-3334323
0910-337238 ",無
1695,石門森林休閒農場,桃園,臺北市南港區園區街3號15樓,"02-2655-7799
0937-040-563",無
1696,豐田休閒農場,桃園,桃園市蘆竹區坑口村07鄰貓尾崎56號,"0910-262-893
",無
1697,大古山休閒農場,桃園,桃園市蘆竹區山腳村18鄰南山路3段302號,"0937-965-936
",無
1698,桃蘆坑休閒農場,桃園,桃園市蘆竹區山林路3段855號旁,"03-324-6557
0935-617-201
",無
1699,台灣氣球博物館,台中,臺中市神岡區大豐路五段505號,04-25284525,週一至週日 09:00-17:00；休息時間 12:00~13:00 (週末除外)
1700,老樹根魔法木工坊,台中,臺中市南區樹義路63號,04-22628621,"團體活動採預約制：週二至週日 09:00-17:00
一般民眾來園體驗：週六、週日、國定假日 09:00-17:00 
週一：休園"
1701,大象藝術空間館,台中,臺中市北區博館路15號1樓,04-22084288,週二至週日 12:00-20:00(週一公休)
1702,猿緣園藝術館,台中,臺中市南區文心南路919號,04-22603888,"週二至週三、週五至週日 12:00-18:00
(週一、週四休館)"
1703,現代畫廊,台中,臺中市西區公益路155巷9號B1,04-23051217,"週二至週日 13:00-21:00
(週一公休)"
1704,台灣創價學會台中藝文中心,台中,臺中市西屯區大容東街90號3樓,04-23270259,週二至週日 09:30-17:00
1705,迷火佛拉明哥藝術中心,台中,臺中市西區臺灣大道二段536號B1A,04-23166610,週一至週五 10:30-22:00；週六 10:30-16:30
1706,臺灣印刷探索館,台中,臺中市大里區中興路一段288號,04-2495-1001,週二~週日 10:00-12:00 & 14:00-16:00
1707,大雋藝術,台中,臺中市南屯區惠文路489號,04-2382-3786,週二至週日 12:00-20:00
1708,鶴軒藝術,台中,臺中市西屯區台灣大道二段666號1樓(長榮桂冠酒店1樓),04-2313-2224,週二至週日 13:00-21:00
1709,松風閣畫廊,台中,臺中市北屯區松竹路二段349號,04-2247 4215,"週一至週五 10:00-20:00
週六 10:00-19:00""
"
1710,74藝術中心,台中,臺中市北屯區環中東路二段597號,04-2436-3385,週一至週日 10:00-20:00 (週五店休)
1711,台中軟體園區Dali Art 藝術廣場國際多功能演藝廳,台中,臺中市大里區科技路1號,04-3700-2003,"週一至週五 11:00-21:00
週末及例假日 09:30-22:00"
1712,TADA Ark方舟音樂藝文展演空間,台中,臺中市南區復興路三段362號(臺中文化創意產業園區B01),04-22290989,週二至週日 11:30- 20:00(週一公休)
1713,福爾摩沙酒店聯盟-半畝塘文創空間,台中,臺中市中區建國路173號2樓,04-22262777,週一至週日 00:00-24:00
1714,一德洋樓,台中,臺中市北屯區文昌東11街14巷1號,04-2233-2959,"週一至週五 09:00-18:00；週六至週日 09:00-21:00
"
1715,台灣味噌釀造文化館,台中,臺中市豐原區西勢路701號,04-25320279 #43 #56,"週一至週日 09:00-17:00 (最後入館時間 16:00)
導覽時間(每日三時段) : 10:00 / 13:00 / 15:00
DIY時間(每日四時段) : 09:00 / 10:00 / 13:00 / 15:00
詳細營業時間請洽官方網站
"
1716,臻品藝術中心,台中,臺中市西區忠誠街35號,04-2323-3215,"週一至週六 09:30-18:30
"
1717,國立勤益科技大學藝術中心,台中,臺中市太平區中山路二段57號,04-23924505,(二) - (五) 10:00-18:00、(六) 09:00-17:00
1718,摘星山莊,台中,臺中市潭子區潭富路二段88號,04-2534-3859,09:00-18:00（17:30停止售票） 每週一、二休館
1719,霧峰林家宮保第園區,台中,臺中市霧峰區民生路26號,04-2331-7985,週一-週日 09:00-12:00 / 13:00-17:00
1720,豐原漆藝館,台中,臺中市豐原區水源路1-1號,04-2513-0177,"週二至週日 09:00-17:00
週一及國定假日休館
"
1721,天染工坊有限公司台中文創店,台中,臺中市大里區國光里勝利二路1號1樓,04-2483-3393,"週二至週日 09:00-17:00
(週一休館)
"
1722,台灣味噌釀造文化館,台中,臺中市豐原區三村里西勢路701號,04-25320279,無
1723,台灣氣球博物館,台中,臺中市神岡區大豐路5段505號,04-25284525,無
1724,張連昌薩克斯風博物館,台中,臺中市后里區公安路330之1號,04-25562363               04-25578989,無
1725,順天堂觀光工廠,台中,臺中市工業區42路16號,0800-070199,無
1726,鞋寶觀光工廠,台中,臺中市西屯區工業區八路11號,04-23590112#116,無
1727,寶熊漁樂館,台中,臺中市潭子區中山路三段11號,04-3501-3338,無
1728,臺灣菸酒(股)公司台中觀光酒廠,台中,臺中市西屯區協和里工業28路2號,04-23501318#430、452,無
1729,老樹根魔法木工坊,台中,臺中市南區樹義路63號,04-22628621,無
1730,阿聰師糕餅文化館,台中,臺中市大安區福興里興安路168號,04-26711477,無
1731,台灣印刷探索館,台中,臺中市大里區中興路一段288號,04-24951001,無
1732,烏日啤酒廠觀光工廠,台中,臺中市烏日區光華街1號,04-23381216,無
1733,泰安派出所,台中,臺中市后里區安眉路27號,無,無
1734,中社花市,台中,臺中市后里區三豐路五段333號,無,無
1735,泰安國小,台中,臺中市后里區安眉路26-9號,無,無
1736,麗寶樂園,台中,臺中市后里區福容路8號,無,無
1737,東勢林場,台中,臺中市東勢區勢林街6-1號,無,無
1738,東勢河濱公園,台中,臺中市東勢區東關路七段,無,無
1739,東勢林業文化園區,台中,臺中市東勢區東關路647號,無,無
1740,大雪山國家森林遊樂園區,台中,臺中市和平區雪山路18號,無,無
1741,八仙山國家森林遊樂園區,台中,臺中市和平區東關路一段200之8號,無,無
1742,武陵農場,台中,臺中市和平區平等里武陵路3-1號,無,無
1743,福壽山農場,台中,臺中市和平區梨山村福壽路29號,無,無
1744,櫻木花道,台中,臺中市新社區中和街三段56巷16號,無,無
1745,薰衣草森林,台中,臺中市新社區中興街20號,無,無
1746,抽藤坑休閒農業園區,台中,臺中市新社區中和里社區,無,無
1747,詠惠生技有限公司,台中,臺中市新社區興中街42-1號,無,無
1748,沐心泉休閒農場,台中,臺中市新社區中和村中興街60號,無,無
1749,新田登山步道,台中,臺中市潭子區龍興巷,無,無
1750,文昌國小旁,台中,臺中市北屯區昌平路一段91號,無,無
1751,?子公園,台中,臺中市北屯區?子路418號,無,無
1752,新福公園,台中,臺中市太平區旱溪東路二段,無,無
1753,亞洲大學,台中,臺中市霧峰區柳豐路500號,無,無
1754,國光公園,台中,臺中市大里區興大南街43號,無,無
1755,芬園花卉生產休憩園區,台中,臺中市烏日區慶光路12-16號,無,無
1756,知高圳步道,台中,臺中市烏日區中山路三段登寺巷176號,無,無
1757,樂成公園,台中,臺中市東區東信里一心街與東英五街口,無,無
1758,興大園區,台中,臺中市東區興大路,無,無
1759,國立臺灣美術館,台中,臺中市西區五權西路一段2號,無,無
1760,文心森林公園,台中,臺中市南屯區文心路一段289號,無,無
1761,豐樂雕塑公園,台中,臺中市南屯區文心南五路331號,無,無
1762,東海大學,台中,臺中市西屯區臺灣大道四段1727號,無,無
1763,都會公園,台中,臺中市西屯區都會園路1215巷140號,無,無
1764,五福圳自行車道,台中,臺中市清水區中山路422-12號,無,無
1765,趙家古厝,台中,臺中市清水區荷園街168號,無,無
1766,大甲鐵砧山風景特定區,台中,臺中市大甲區成功路221號,無,無
1767,水流東桐花步道,台中,臺中市外埔區六支巷路21號,無,無
1768,水頭二路,台中,臺中市外埔區水頭二路,無,無
1769,潭子落羽松祕境,台中,臺中市潭子區豐興路二段龍興巷,無,無
1770,靜宜大學_主顧聖母堂,台中,臺中市沙鹿區台灣大道七段200號,04-26328001,無
1771,大雅麥田,台中,臺中市大雅區神林路一段231巷,04-25662216,無
1772,學田山 (雪蓮步道),台中,臺中市大肚區王福街2巷32弄38號,無,無
1773,葫蘆墩公園,台中,臺中市豐原區圓環北路二段65號,04-22289111#33900,無
1774,公老坪,台中,臺中市豐原區水源路,無,無
1775,中科橫山公園,台中,臺中市大雅區通山路,04-25658588,無
1776,外埔忘憂谷,台中,臺中市外埔區溪底路,無,無
1777,大肚藍色公路,台中,臺中市大肚區大肚藍色公路,無,無
1778,九天黑森林,台中,臺中市沙鹿區竹林里,無,無
1779,頂魚寮公園,台中,臺中市梧棲區八德東路,04-26564311,無
1780,南埔鷺鷥林,台中,臺中市大安區南莊海堤19號,無,無
1781,甲后自行車道,台中,臺中市后里區大甲區、外埔區,無,無
1782,大呷麵本家故事館,台中,臺中市大甲區重義二路153號,04-26862239,無
1783,臺中市原住民綜合服務中心,台中,臺中市大雅區仁愛路69號,04-25602710,無
1784,臺灣火柴故事館,台中,臺中市南區工學路72號,04-22626105#315,無
1785,帝國製糖廠臺中營業所,台中,臺中市東區樂業路與進德路交叉口,04-22112898,無
1786,原日軍臺中飛行場機槍堡,台中,臺中市北屯區經貿三路二段與經貿東路口,無,無
1787,積善樓,台中,臺中市北屯區興安路一段163號,無,無
1788,國光假日花市,台中,臺中市大里區國光路二段100號,04-24832770,無
1789,立法院議政博物館,台中,臺中市霧峰區中正路 734 號,04-23310868,無
1790,臺中監獄矯正教育館,台中,臺中市南屯區培德路7號,無,無
1791,MITSUI OUTLET PARK 台中港,台中,臺中市梧棲區臺灣大道十段168號,04-25218999,無
1792,高美濕地遊客服務中心,台中,臺中市清水區美堤街8號,04-26111566,無
1793,中國醫藥大學立夫中醫藥博物館,台中,臺中市北區學士路91號(互助大樓1樓),04-22053366#1670,無
1794,林之助紀念館,台中,臺中市西區柳川西路二段158號,04-22183652,無
1795,臺中作家典藏館,台中,臺中市北區精武路291之3號4樓,04-22293875,無
1796,臺中市纖維工藝博物館,台中,臺中市大里區勝利二路1號,04-24860069,無
1797,霧峰．民生．故事館,台中,臺中市霧峰區中正路369號,04-23391556,無
1798,太平買菸場,台中,臺中市太平區東平路464號,04-22790446,無
1799,大振豐洋傘文創主題館,台中,臺中市北屯區太原路三段1160號,04-22317689,無
1800,南勢溪湧泉,台中,臺中市沙鹿區南昌路128號,無,無
1801,台中港區運動公園,台中,臺中市沙鹿區自強路301號,無,無
1802,筏子溪門戶迎賓水岸廊道,台中,臺中市南屯區筏子東街一段33-59號,無,無
1803,洲際棒球文創園區,台中,臺中市北屯區崇德路三段833號,04-24228809,無
1804,青桐林生態區步道,台中,臺中市霧峰區北坑產業道路,無,無
1805,阿罩霧櫻花杜鵑步道,台中,臺中市霧峰區霧峰萊園里與坑口里的交界,無,無
1806,萬豐環山步道,台中,臺中市霧峰區中正路176巷,無,無
1807,中心瓏登山步道,台中,臺中市霧峰區中正路734號,無,無
1808,乾溪自行車道,台中,臺中市霧峰區中正橋,無,無
1809,山線自行車道(專用道路段),台中,臺中市大里區立善橋,無,無
1810,草湖溪自行車道,台中,臺中市大里區草湖溪美群橋至草湖溪銀聯,無,無
1811,東勢林場,台中,臺中市東勢區勢林街6-1號,04-25872191,無
1812,中華民國農會休閒綜合農牧場,台中,臺中市外埔區水美里二崁路700號,04-26872724,無
1813,水美李宅古厝,台中,臺中市外埔區水美路30號,無,無
1814,臺中市立圖書館溪西分館,台中,臺中市西屯區福玄路1號,04-23553011#10,無
1815,頂街派出所,台中,臺中市豐原區中正路5號,04-25348225#20,無
1816,Sylvia創意小學堂-miniCNC雕刻體驗館,台中,臺中市豐原區北陽路8號2樓,04-25228312,無
1817,寶泉甘味手造所,台中,臺中市豐原區豐勢路一段468號,04-25131390,無
1818,豐園北科大木創中心,台中,臺中市豐原區臺中市豐原區豐勢路一段551號,04-25132677,無
1819,亨德公園,台中,臺中市龍井區中沙路南寮巷70號,無,無
1820,龍目井,台中,臺中市龍井區沙田路五段龍目井巷76號1樓,無,無
1821,陳三綱堂,台中,臺中市龍井區文昌路429號,無,無
1822,龍井堤防自行車道,台中,臺中市龍井區中華路2段15號,無,無
1823,竹坑ˍ南寮登山步道,台中,臺中市龍井區中沙路南寮巷70號,無,無
1824,秀泰生活台中站前店,台中,臺中市東區南京路76號,04-22117988,無
1825,西岐城_西岐里活動中心,台中,臺中市大甲區順帆路56-2號,無,無
1826,太平蝙蝠洞及百蝙吊橋,台中,臺中市太平區蝙蝠洞,無,無
1827,頭汴坑溪自行車道,台中,臺中市太平區頭汴坑溪自行車道,無,無
1828,臺中市濱海自行車道ˍ大安段,台中,臺中市大安區臺中市濱海自行車道－大甲段,無,無
1829,頭汴坑酒桶山自行車道,台中,臺中市太平區頭汴坑酒桶山自行車道,無,無
1830,永豐六分線自行車道,台中,臺中市外埔區永豐六分線自行車道,無,無
1831,中科自行車道,台中,臺中市西屯區中科自行車道,無,無
1832,五福圳自行車道,台中,臺中市清水區中山路422-12號,無,無
1833,高美濕地自行車道,台中,臺中市清水區高美濕地自行車道,無,無
1834,臺中市濱海自行車道ˍ大甲段,台中,臺中市大甲區臺中濱海自行車道－大甲段,無,無
1835,筏子溪自行車道,台中,臺中市西屯區筏子溪自行車道,無,無
1836,綠川水岸廊道,台中,臺中市中區綠川西街135號,無,無
1837,舊社里彩繪村,台中,臺中市后里區舊社里舊社路93號,無,無
1838,潭子觀光蘭園,台中,臺中市潭子區大豐一路89巷8號,04-25328116,無
1839,永信醫藥文物館,台中,臺中市大甲區成功路321號,04-26879275,無
1840,瑞井手作步道,台中,臺中市大肚區瑞井路,無,無
1841,高美濕地景觀橋,台中,臺中市清水區高美路789號,無,無
1842,新天地西洋博物館,台中,臺中市東區旱溪東路一段456號1樓,04-22136222,無
1843,清水趙家古厝,台中,臺中市清水區中山路476號,無,無
1844,好好聚落文創園區,台中,臺中市沙鹿區鎮南路永福巷7號,無,無
1845,DaliArt 藝術廣場,台中,臺中市大里區科技路1號,無,無
1846,原東勢公學校宿舍,台中,臺中市東勢區第五橫街38-2號,無,無
1847,金門橋,台中,臺中市東勢區東關路和興巷31號前,無,無
1848,月恆門,台中,臺中市東勢區東關路和興巷31號,04-25872106,無
1849,興大康橋,台中,臺中市大里區環河路與 爽 文 路口,無,無
1850,一德洋樓ˍ台中市歷史建築林懋陽故居,台中,臺中市北屯區文昌東十一街14巷1號,04-22332959,無
1851,審計新村,台中,臺中市西區民生路368巷,無,無
1852,新臺中火車站,台中,臺中市中區臺灣大道一段1號,04-22216492,無
1853,柳川水岸步道,台中,臺中市中區柳川東路三段7號,無,無
1854,阿薩斯雕像,台中,臺中市西區西區向上北路100號,無,無
1855,臺中市眷村文物館,台中,臺中市北屯區天祥街19號,04-22334073,無
1856,彰化銀行總行及行史館,台中,臺中市中區自由路二段38號,04-22230001,無
1857,霧峰落羽杉,台中,臺中市霧峰區北岸路66號,無,無
1858,思源埡口,台中,臺中市和平區思源埡口,無,無
1859,大坑景觀橋,台中,臺中市北屯區軍福十三路,無,無
1860,太平光興隆大橋,台中,臺中市太平區太平路與興隆路一段交會處,無,無
1861,黎明新村,台中,臺中市南屯區干城街,無,無
1862,青桐林生態園區,台中,臺中市霧峰區桐林里北坑溪,無,無
1863,清水大楊油庫,台中,臺中市清水區楊厝里頂三庄路10-1號,無,無
1864,抽藤坑休閒農業區,台中,臺中市新社區中和里社區,0928-629627,無
1865,麗水漁港,台中,臺中市龍井區三港路65號,無,無
1866,菩薩寺,台中,臺中市大里區永隆路147號,04-24079920,無
1867,馬鞍壩生態園區,台中,臺中市和平區天輪里東關路2段89-1號,04-25941574#625,無
1868,水流東休閒農業區,台中,臺中市外埔區永豐里六分路90號 (外埔旅客服務中心),04-26832311#205,無
1869,梨之鄉休閒農業區,台中,臺中市東勢區東崎街四段242號,04-25881829,無
1870,IKEA 宜家家居,台中,臺中市南屯區向上路二段168號,04-27049699,無
1871,台灣太陽餅博物館,台中,臺中市中區臺灣大道一段145號,04-22295559,無
1872,臺中文學館,台中,臺中市西區樂群街38號,04-22240875,無
1873,牛罵頭遺址文化園區,台中,臺中市清水區鰲海路59號,04-22290280#505,無
1874,坪林森林公園,台中,臺中市太平區中山路二段 (803國軍醫院對面),無,無
1875,八方國際商城ˍ八方國際觀光夜市,台中,臺中市豐原區豐原大道一段165號,04-25238367,無
1876,鎮瀾文化大樓,台中,臺中市大甲區和平路223號,04-26763566,無
1877,社口林宅ˍ大夫第,台中,臺中市神岡區社口村文化街68號、70號、72號,04-22290280#507,無
1878,清水眷村文化園區,台中,臺中市清水區中社路信義巷41號,04-26274568,無
1879,大肚瑞井里,台中,臺中市大肚區瑞井里,04-26991105,無
1880,磐頂教堂,台中,臺中市龍井區遊園南路361巷15號,04-26312522,無
1881,光復新村,台中,臺中市霧峰區(光復新站)和平路2-3號,無,無
1882,龍富夜市,台中,臺中市南屯區龍富18路,0926-586668,無
1883,新社星願紫風車,台中,臺中市新社區中興嶺停車場,04-22289111#31316,無
1884,大安水蓑衣生態教育園區,台中,臺中市大安區南莊海堤17號,04-26873560,無
1885,國立臺灣音樂文化園區,台中,臺中市霧峰區中正路738之2號,04-23391141,無
1886,草悟廣場,台中,臺中市西區英才路534號,04-23021232,無
1887,松鶴部落,台中,臺中市和平區台8線29公里處,04-25943467,無
1888,綠光計畫,台中,臺中市西區中興一巷2號～26號,04-23016717,無
1889,屯區藝文中心,台中,臺中市太平區大興路201號,04-23921122,無
1890,公益路商圈,台中,臺中市西區公益路沿線,無,無
1891,霧峰樹仁商圈,台中,臺中市霧峰區樹仁路,無,無
1892,勤美術館,台中,臺中市西區館前路71號,08-00266155,無
1893,芬園花卉生產休憩園區,台中,臺中市烏日區慶光路12-16號,04-2524899,無
1894,高美燈塔,台中,臺中市清水區高美路748號,04-26113924,無
1895,廟東夜市,台中,臺中市豐原區中正路167巷,04-25222106,無
1896,高鐵臺中站,台中,臺中市烏日區站區二路8號,04-36015000,無
1897,中區再生基地,台中,臺中市中區中山路69號,04-22203035,無
1898,第四信用合作社,台中,臺中市中區中山路72號,04-22271966,無
1899,臺中國家歌劇院,台中,臺中市西屯區惠來路二段101號,04-22511777,無
1900,東勢林業文化園區,台中,臺中市東勢區東關路647號(國立東勢高工旁),04-25774146,無
1901,紙箱王創意園區-大坑店,台中,臺中市北屯區東山路二段二巷二號,04-22398868#26,無
1902,臺灣印刷探索館,台中,臺中市大里區中興路一段288號,04-24951001,無
1903,國定古蹟霧峰林家宮保第園區,台中,臺中市霧峰區民生路26號,04-23317985,無
1904,順天堂觀光工廠,台中,臺中市西屯區工業區42路16號,04-23594848#280,無
1905,鳳凰山農場,台中,臺中市后里區仁里村圳寮路47巷7號,0912-799177,無
1906,新社商圈,台中,臺中市新社區中興嶺停車場,04-25821058,無
1907,亞洲大學現代美術館,台中,臺中市霧峰區柳豐路500號,04-23323456#6468,無
1908,東海夜市,台中,臺中市龍井區新興路,無,無
1909,臺灣香蕉新樂園,台中,臺中市北區雙十路二段111號,04-22345402,無
1910,新都生態公園,台中,臺中市北屯區臺中市和祥路一段,無,無
1911,龜殼公園,台中,臺中市大安區溫寮四號海堤,無,無
1912,寶熊漁樂碼頭,台中,臺中市潭子區中山路三段11號,04-35013338,無
1913,匠師的故鄉休閒農業區,台中,臺中市大甲區順帆路121巷16之5號,無,無
1914,縱貫鐵路海線清水車站,台中,臺中市清水區中正街115號,04-26222021,無
1915,梧棲老街,台中,臺中市梧棲區梧棲路頂橫街,無,無
1916,劉秀才古厝,台中,臺中市外埔區外埔區三崁路73號,04-26833908,無
1917,紅樹林生態區,台中,臺中市大安區海墘村大安港路1149號,無,無
1918,萬里長城登山步道,台中,臺中市大肚區萬里長城健康步道,無,無
1919,潭子運動公園,台中,臺中市潭子區勝利路138號,無,無
1920,大甲文昌祠,台中,臺中市大甲區文武路116號,04-26872101,無
1921,摘星山莊,台中,臺中市潭子區潭富路二段88號,04-25343859,無
1922,國道臺中清水服務區休息站,台中,臺中市清水區東山路145號,04-26201378,無
1923,梧棲朝元宮,台中,臺中市梧棲區梧棲路140號,04-26562387,無
1924,天梯步道,台中,臺中市東勢區東勢軟埤坑農業區之天公廟後方,無,無
1925,大庄浩天宮,台中,臺中市梧棲區中央路一段784號,04-26565949,無
1926,東勢河濱公園,台中,臺中市東勢區東勢河濱公園,04-22293079,無
1927,鹿寮成衣商圈,台中,臺中市沙鹿區鹿寮成衣商圈,無,無
1928,石岡老街,台中,臺中市石岡區石岡街,04-25722511,無
1929,石岡穀倉,台中,臺中市石岡區忠孝街160號,04-25722764,無
1930,沙鹿之翼,台中,臺中市沙鹿區中棲路281-3號,無,無
1931,意得客超導熱奈米博物館,台中,臺中市大肚區沙田路三段245巷83號,04-26992187,無
1932,木匠兄妹木工房,台中,臺中市后里區舊圳路4-12號,04-25590689,無
1933,趙家窯,台中,臺中市大雅區員林村大林路66巷12號,04-25662056,無
